<!ELEMENT student (id, regno, name, avg, dob, time, mobileno, distinction) >
<!ELEMENT id (#PCDATA)>
<!ELEMENT regno (#PCDATA)>
<!ELEMENT name (#PCDATA)>
<!ELEMENT avg (#PCDATA)>
<!ELEMENT dob (#PCDATA)>
<!ELEMENT time (#PCDATA)>
<!ELEMENT mobileno (#PCDATA)>
<!ELEMENT distinction (#PCDATA)>